name,url,description,duration,remote_support,adaptive_support,test_type
Gaming Manager Solution,https://www.shl.com/products/product-catalog/view/gaming-manager-solution,"The Gaming Manager solution is designed for management level positions within the hospitality industry. Sample tasks include managing operations, supervisors and associates within gaming environments. The solution is focused on security, integrity and managing sales. Potential job titles that use this solution are: Gaming Floor Manager and Gaming Manager. Multiple configurations of this solution are available.",Not Available,No,No,Simulations | Ability & Aptitude | Personality & Behavior | Knowledge & Skills
General Diseases (New),https://www.shl.com/products/product-catalog/view/general-diseases-new,"Multi-choice test that measures the knowledge of common diseases of ear, nose, throat and teeth, their symptoms, drugs used to treat them and various drugs used to relieve pain.",Not Available,No,No,Knowledge & Skills
General Entry Level - All Industries 7.0 Solution,https://www.shl.com/products/product-catalog/view/general-entry-level-all-industries-7-0-solution,"Our General Entry Level – All Industries 7.0 solution is designed for entry-level positions across industries. This solution predicts the following types of behaviors foundational to all jobs: being on-time to work; following rules and policies; treating others respectfully; producing quality work; meeting goals; and effectively working alongside others. Solution can be used across all industries with entry-level positions. Example titles include, but are not limited to: Administrator, Clerk, Veterinary Assistant, Stocker, Dish Washer, Office Coordinator, Tour Guide, Cook, Assistant, Housekeeper, Waste Collector.",Not Available,No,No,Personality & Behavior
General Entry Level - All Industries 7.1(Americas),https://www.shl.com/products/product-catalog/view/general-entry-level-all-industries-7-1%28americas%29,"Our General Entry Level – All Industries 7.1 solution is designed for entry-level positions across industries. This solution predicts the following types of behaviors foundational to all jobs: being on-time to work; following rules and policies; treating others respectfully; producing quality work; meeting goals; and effectively working alongside others. Solution can be used across all industries with entry-level positions. Example titles include, but are not limited to: Administrator, Clerk, Veterinary Assistant, Stocker, Dish Washer, Office Coordinator, Tour Guide, Cook, Assistant, Housekeeper, Waste Collector.",Not Available,No,No,Personality & Behavior
General Entry Level - All Industries 7.1 Solution,https://www.shl.com/products/product-catalog/view/general-entry-level-all-industries-7-1-solution,"Our General Entry Level – All Industries 7.1 solution is designed for entry-level positions across industries. This solution predicts the following types of behaviors foundational to all jobs: being on-time to work; following rules and policies; treating others respectfully; producing quality work; meeting goals; and effectively working alongside others. Solution can be used across all industries with entry-level positions. Example titles include, but are not limited to: Administrator, Clerk, Veterinary Assistant, Stocker, Dish Washer, Office Coordinator, Tour Guide, Cook, Assistant, Housekeeper, Waste Collector.
“MCP Product: please note that you will need to select the correct package depending on which norm you intend to use. The package available for this product is Americas and International.""",Not Available,No,No,Personality & Behavior
General Entry Level – Data Entry 7.0 Solution,https://www.shl.com/products/product-catalog/view/general-entry-level-data-entry-7-0-solution,"Our General Entry Level – Data Entry 7.0 solution is designed for entry-level positions that include entering data into computers or data management systems. This solution measures speed and accuracy at typing text and numbers into forms and predicts the following types of behaviors foundational to all jobs: being on-time to work; following rules and policies; treating others respectfully; producing quality work; meeting goals; and approaching work in a thorough and precise manner. This solution can be used across all industries with entry-level positions. Example titles include, but are not limited to: Accounting Clerk, Accounts Receivable Clerk, Administrative Clerk, Clerical Aide, Clerical Assistant, Office Assistant, Office Services Specialist, Staff Assistant.
Report Language Availability: English (USA)",Not Available,No,No,Personality & Behavior | Knowledge & Skills
Geoinformatics Engineering (New),https://www.shl.com/products/product-catalog/view/geoinformatics-engineering-new,"Multi-choice test that measures the knowledge of remote sensing, digital image processing, digital photogrammetry, planning and surveying, geology, GIS and drilling Engineering.",Not Available,No,No,Knowledge & Skills
Geoscience Engineering (New),https://www.shl.com/products/product-catalog/view/geoscience-engineering-new,"Multi-choice test that measures the knowledge of exploration geology, soil mechanics, rock mechanics, geophysical investigation, geological surveying.",Not Available,No,No,Knowledge & Skills
GIT (New),https://www.shl.com/products/product-catalog/view/git-new,Multi-choice test that measures the knowledge of how to use GIT for version control.,Not Available,No,No,Knowledge & Skills
Global Skills Assessment,https://www.shl.com/products/product-catalog/view/global-skills-assessment,The Global Skills Assessment (GSA) is an assessment used to measure 96 discrete skills/behaviors. These 96 skill scores are directly aligned to the most discrete level of SHL’s Universal Competency Framework (UCF). The GSA measures self-reported behaviors an individual currently engages in. A person’s skills (sets of behavior) are malleable and may change over time. SHL utilizes GSA scores to understand what the participant reports they can do today.,Not Available,No,No,Competencies | Knowledge & Skills
Global Skills Development Report,https://www.shl.com/products/product-catalog/view/global-skills-development-report,"This report is designed to be given to individuals who have completed the Global Skills Assessment (GSA). With coverage across the Great 8 Domains, this measure of self-reported behaviors offers a complete overview of their current skills. Participants receive actionable tips on leveraging their top skill strengths and how they might develop their growth skills.",Not Available,No,No,Ability & Aptitude | Assessment Exercises | Personality & Behavior | Competencies | Development & 360
Graduate 7.1 Job Focused Assessment,https://www.shl.com/products/product-catalog/view/graduate-7-1-job-focused-assessment,"Chinese Simplified, English (USA), French, German, English International, Italian, Japanese, Latin American Spanish, Polish, Russian, Swedish, Dutch, Portuguese (Brazil),",Not Available,No,No,Personality & Behavior | Competencies
Graduate + 8.0 Job Focused Assessment,https://www.shl.com/products/product-catalog/view/graduate-8-0-job-focused-assessment,"The Graduate + 8.0 Job Focused Assessment is a short, targeted, globally applicable assessment which includes a short cognitive ability measure. It helps you identify graduates with the highest potential to contribute and succeed, as well as providing actionable feedback to help you onboard new hires.
It is designed for professional level positions appropriate for recent college graduates and is available as part of SHL’s Graduate Solution.",30 minutes,No,No,Ability & Aptitude | Personality & Behavior
Graduate 8.0 Job Focused Assessment,https://www.shl.com/products/product-catalog/view/graduate-8-0-job-focused-assessment-4228,"The Graduate 8.0 Job Focused Assessment is a short, targeted, globally applicable assessment to help you identify graduates with the highest potential to contribute and succeed. It also provides actionable feedback to help you onboard new hires.
It is designed for professional level positions appropriate for recent college graduates and is available as part of SHL’s Graduate Solution.",20 minutes,No,No,Personality & Behavior
Graduate Scenarios,https://www.shl.com/products/product-catalog/view/graduate-scenarios,"Graduate Scenarios is a unique test of Managerial Judgement - an individual’s ability to decide on effective ways of handling real life situations. It is specifically designed to assess judgement in graduates; a group who typically has limited work experience to draw on. It consists of hypothetical scenarios, each followed by several possible responses. Candidates rate the effectiveness of each response, using a 6-point scale, from highly undesirable to highly desirable. It can be used for recruitment, selection, training and development, performance management and coaching in a variety of functions and industries. Reports available: Graduate Scenarios Narrative Report: A participant focused report that contains; - Graduate Scenarios profile - Feedback report (with development tips) breaking down the overall Managerial judgement results into each of the 3 sub-scales; Managing Objectives, People Management and Corporate Management. Graduate Scenarios Profile: Displays all scores on these scales in terms of four types of norm system; T-scores, Percentiles, Stens and Grades.",Not Available,No,No,Personality & Behavior
Graduate Scenarios Narrative Report,https://www.shl.com/products/product-catalog/view/graduate-scenarios-narrative-report,"Graduate Scenarios is a unique test of Managerial Judgement - an individual’s ability to decide on effective ways of handling real life situations. It is specifically designed to assess judgement in graduates; a group who typically has limited work experience to draw on. It consists of hypothetical scenarios, each followed by several possible responses. Candidates rate the effectiveness of each response, using a 6-point scale, from highly undesirable to highly desirable. It can be used for recruitment, selection, training and development, performance management and coaching in a variety of functions and industries. Reports available: Graduate Scenarios Narrative Report: A participant focused report that contains; - Graduate Scenarios profile - Feedback report (with development tips) breaking down the overall Managerial judgement results into each of the 3 sub-scales; Managing Objectives, People Management and Corporate Management. Graduate Scenarios Profile: Displays all scores on these scales in terms of four types of norm system; T-scores, Percentiles, Stens and Grades.",Not Available,No,No,Personality & Behavior
Graduate Scenarios Profile Report,https://www.shl.com/products/product-catalog/view/graduate-scenarios-profile-report,"Graduate Scenarios is a unique test of Managerial Judgement - an individual’s ability to decide on effective ways of handling real life situations. It is specifically designed to assess judgement in graduates; a group who typically has limited work experience to draw on. It consists of hypothetical scenarios, each followed by several possible responses. Candidates rate the effectiveness of each response, using a 6-point scale, from highly undesirable to highly desirable. It can be used for recruitment, selection, training and development, performance management and coaching in a variety of functions and industries. Reports available: Graduate Scenarios Narrative Report: A participant focused report that contains; - Graduate Scenarios profile - Feedback report (with development tips) breaking down the overall Managerial judgement results into each of the 3 sub-scales; Managing Objectives, People Management and Corporate Management. Graduate Scenarios Profile: Displays all scores on these scales in terms of four types of norm system; T-scores, Percentiles, Stens and Grades.",Not Available,No,No,Personality & Behavior
Guest Service Team 7.0 Solution,https://www.shl.com/products/product-catalog/view/guest-service-team-7-0-solution,"Our Guest Service Team 7.0 solution is designed for team-oriented entry-level positions that involve a high degree of interaction with customers. The solution covers a wide variety of positions, and assesses competencies critical to interacting with customers including: persisting to meet guest needs; behaving responsibly and appropriately; effectively working alongside others; preparing and/or delivering customer orders; following rules and policies; and communicating effectively. Potential job titles that use this solution include: Server, Hostess, Guest Services Team Member, Customer Service Champion.
Report Language Availability: English (USA), Latin American Spanish.",Not Available,No,No,Personality & Behavior
Guest Services Associate Solution,https://www.shl.com/products/product-catalog/view/guest-services-associate-solution,"The Guest Services Associate solution is designed for entry to mid-level customer service positions in the hospitality industry. The solution is for highly customer service focused positions with few to no sales components. Sample tasks may include: providing information on entertainment, dining and transportation to guests, making dining recommentations to guests, arranging transportation for guests, and making reservations. Potential job titles that use this solution are: Concierge, Guest Services Agent, Club Concierge, Hotel Concierge, Front Office Manager and Guest Services Associate. Multiple configurations of this solution are available.",Not Available,No,No,Ability & Aptitude | Personality & Behavior | Simulations
Healthcare Aide 7.0 Solution,https://www.shl.com/products/product-catalog/view/healthcare-aide-7-0-solution,"Our Healthcare Aide 7.0 solution is designed for individually-oriented, entry-level positions that directly support another person's health and well-being. The solution covers a wide variety of positions, and assesses behaviors critical for patient support roles including: understanding and following detailed instructions; administering personal care; being respectful and tolerant of patients; preparing and maintaining records of patient progress and services performed; and working hard to meet or exceed patient needs. Potential job titles that use this solution include: Personal Care Aide, Healthcare Aide, Home Health Aide, Dental Assistant.
Report Language Availability: English (USA), Latin American Spanish.",Not Available,No,No,Personality & Behavior
Healthcare Call Center Agent Solution,https://www.shl.com/products/product-catalog/view/healthcare-call-center-agent-solution,"The Healthcare Call Center Agent solution is for entry-level positions in an inbound healthcare call center environment. Sample tasks for this job include, but are not limited to: taking and receiving information from patients over the phone, working between computer screens, and entering information into a computer. Potential job titles that use this solution are: Call Center Representative, Receptionist, and Switchboard Operator. Multiple configurations of this solution are available.",Not Available,No,No,Ability & Aptitude | Personality & Behavior | Simulations
Healthcare Service Associate Solution,https://www.shl.com/products/product-catalog/view/healthcare-service-associate-solution,"The Healthcare Service Associate solution is for entry-level positions in a healthcare environment that require the employee to interact with patients. Sample tasks for this job include, but are not limited to: delivering food to patients, cleaning patient rooms, and welcoming guests to the hospital. Potential job titles that use this solution are: Housekeepers, Dietary Aides, and Guest Services Coordinator. There are multiple configurations and versions of this solution available.",Not Available,No,No,Ability & Aptitude | Personality & Behavior
Healthcare Support Specialist Solution,https://www.shl.com/products/product-catalog/view/healthcare-support-specialist-solution,"The Healthcare Support Specialist solution is for entry-level positions in a healthcare environment that do not require the employee to interact with patients. Sample tasks for this job include, but are not limited to: preparing food for patients, washing hospital linens, and cleaning the healthcare facility. Potential job titles that use this solution are: Janitors, Food Preparation Workers, and Laundry Associates. Multiple configurations of this solution are available.",Not Available,No,No,Ability & Aptitude | Personality & Behavior
Hibernate (New),https://www.shl.com/products/product-catalog/view/hibernate-new,"Multi-choice test that measures the knowledge of Hibernate architecture, Hibernate mapping and Hibernate query language(HQL).",Not Available,No,No,Knowledge & Skills
HIPAA (Security),https://www.shl.com/products/product-catalog/view/hipaa-security,"The HIPAA (Security) test measures knowledge of compliance with the standards required by the Security and Electronic Signature Standards as they apply to HIPAA. Designed for healthcare professionals and concentrating on nontechnical as well as technical aspects of the HIPAA Standards for Security and Electronic Signatures, this test covers the following topics: Computer Mechanisms, Computer Models, General Knowledge, Implementation, Medical Records, Organization, Security Basics, and Setup.",Not Available,No,No,Knowledge & Skills
HiPo Assessment Report 1.0,https://www.shl.com/products/product-catalog/view/hipo-assessment-report-1-0,"Part of SHL’s High Potential solution and developed from SHL’s extensive research into high-potential programs, the HIPO Assessment Report 1.0 helps organizations identify individuals with the strongest potential to succeed in senior and challenging roles. Using assessments such as the Motivation Questionnaire, OPQ, and Verify Cognitive Ability Tests, the report evaluates critical areas of aspiration, ability, and engagement. This version is used in regions where normed data for Verify Gen 1 and UCF 1 continue to provide the most relevant benchmarks, offering organizations proven insights for high-potential identification and talent development.",Not Available,No,No,Competencies | Personality & Behavior
HiPo Assessment Report 2.0,https://www.shl.com/products/product-catalog/view/hipo-assessment-report-2-0,"Part of SHL’s High Potential solution and developed from SHL’s extensive research into high-potential programs, the HIPO Assessment Report 2.0 helps organizations identify individuals with the strongest potential to succeed in senior and challenging roles. Using assessments such as the Motivation Questionnaire, OPQ, and Verify Cognitive Ability Tests, the report evaluates critical areas of aspiration, ability, and engagement. This report equips organizations with data-driven insights for identifying and developing future leaders, helping to ensure long-term organizational success.",Not Available,No,No,Competencies | Personality & Behavior
HiPo Unlocking Potential Report 2.0,https://www.shl.com/products/product-catalog/view/hipo-unlocking-potential-report-2-0,"This report draws insights from the Occupational Personality QuestionnaireTM (OPQ32). Used for individuals who are selected into a client’s HiPo program, it provides a detailed analysis of managerial and leadership potential.",Not Available,No,No,Competencies
Home Health Aide Solution,https://www.shl.com/products/product-catalog/view/home-health-aide-solution,"The Home Health Aide solution is for entry-level positions in an in-home or group home environment. Sample tasks for this job include, but are not limited to: monitoring vital signs and medication intake, administering bedside and personal care such as ambulation and personal hygiene, and preparing and maintaining records of patient progress and services performed. Potential job titles that use this solution are: Personal Care Aide, Home Health Aide, Residential Assistant, and Certified Nursing Assistant. There are multiple configurations and versions of this solution available.",Not Available,No,No,Ability & Aptitude | Personality & Behavior
Hospitality Manager Solution,https://www.shl.com/products/product-catalog/view/hospitality-manager-solution,"The Hospitality Manager solution is designed for management level positions in the hospitality industry. Sample tasks include overall property management, managing staff and managing the guest experience. The solution is focused on managing business operations, managing staff, solving problems, making good decisions and maintaining focus on the customer. Potential job titles that use this solution are: Property Manager, Property Director, Hotel Manager and Hospitality Manager. Multiple configurations of this solution are available.",Not Available,No,No,Ability & Aptitude | Personality & Behavior | Knowledge & Skills
Host Solution,https://www.shl.com/products/product-catalog/view/host-solution,"The Host solution is designed for entry level positions in the hospitality industry. Sample tasks include greeting guests, managing wait lists and showing guests to their tables. The solution is focused on work ethic and customer focus. Potential job titles that use this solution are: Host, Hostess and Greeter. There are multiple configurations and versions of this solution available.",Not Available,No,No,Personality & Behavior
Housekeeping (New),https://www.shl.com/products/product-catalog/view/housekeeping-new,"Multi-choice test that measures the knowledge of housekeeping activities such as cleaning, laundry, room maintenance and routine checks.",Not Available,No,No,Knowledge & Skills
HTML5 (New),https://www.shl.com/products/product-catalog/view/html5-new,Multi-choice test that measures the knowledge of HTML5 and its application in creating a user interface.,Not Available,No,No,Knowledge & Skills
HTML/CSS (New),https://www.shl.com/products/product-catalog/view/htmlcss-new,Multi-choice test that measures the knowledge of HTML to create a user interface and CSS to stylize it.,Not Available,No,No,Knowledge & Skills
Human Resources (New),https://www.shl.com/products/product-catalog/view/human-resources-new,"Multi-choice test that measures the candidate on his/her knowledge and understanding of the basic concepts of Human Resources Management like planning, training and development, performance appraisal, compensation management, etc. It also evaluates the candidate’s understanding of organizational behavior in different organizational structures.",Not Available,No,No,Knowledge & Skills
IBM DataStage (New),https://www.shl.com/products/product-catalog/view/ibm-datastage-new,"Multi-choice test that measures the knowledge on the concepts of Data Warehouse fundamentals, DataStage fundamentals, DataStage stages and, DataStage Designer & Director.",Not Available,No,No,Knowledge & Skills
IBM Sterling Order Management System (New),https://www.shl.com/products/product-catalog/view/ibm-sterling-order-management-system-new,"Multi-choice test that measures the knowledge of the basic concepts of Sterling Order Management System installation, modeling, extensibility, inventory reservations, etc.",Not Available,No,No,Knowledge & Skills
Industrial Engineering (New),https://www.shl.com/products/product-catalog/view/industrial-engineering-new,"Multi-choice test that measures the conceptual knowledge of design, quality control, reliability, management and costing of manufacturing systems.",Not Available,No,No,Knowledge & Skills
Industrial - Entry Level 7.0 Solution,https://www.shl.com/products/product-catalog/view/industrial-entry-level-7-0-solution,"Our Industrial – Entry Level 7.0 solution is designed for entry-level positions, and measures the behaviors and experiences that underlie successful and safe performance in general or light industrial roles. The solution covers a wide variety of entry-level positions, and assesses behaviors including: following policies and procedures; general facility upkeep; producing high quality work; maintaining an orderly work environment; wearing required protective equipment; and being thorough. Potential job titles that use this solution include: Laborer, Custodians, Building and Grounds Maintenance Workers, Handyman.
Report Language Availability: English (USA), Latin American Spanish.",Not Available,No,No,Personality & Behavior
Industrial - Entry Level 7.1 (Americas),https://www.shl.com/products/product-catalog/view/industrial-entry-level-7-1-%28americas%29,"Our Industrial – Entry Level 7.1 solution is designed for entry-level positions, and measures the behaviors and experiences that underlie successful and safe performance in general or light industrial roles. The solution covers a wide variety of entry-level positions, and assesses behaviors including: following policies and procedures; general facility upkeep; producing high quality work; maintaining an orderly work environment; wearing required protective equipment; and being thorough. Potential job titles that use this solution include: Laborer, Custodians, Building and Grounds Maintenance Workers, Handyman.
“IMPORTANT! Please note that you will need to select the correct package depending on which norm you intend to use. The package available for this product is International and Americas"".",Not Available,No,No,Personality & Behavior
