name,url,description,duration,remote_support,adaptive_support,test_type
Retail Sales Associate Solution,https://www.shl.com/products/product-catalog/view/retail-sales-associate-solution,"The Retail Sales Associate solution is for entry-level retail positions in which employees proactively sell products to customers and have their pay and/or performance based on sales revenue. Sample tasks for these jobs include, but are not limited to: promoting products to customers, persuading customers to buy products, and completing a transaction with a customer. Potential job titles that use this solution are: Sales Representative, Retail Sales Associate, and Sales Clerk. There are multiple configurations and versions of this solution available.",Not Available,No,No,Ability & Aptitude | Personality & Behavior
Reviewing Forms - US (R1),https://www.shl.com/products/product-catalog/view/reviewing-forms-us-r1,"This assessment measures ability to detect errors in forms by comparing text in a form to text in a paragraph format. Based on information in the paragraph, the test taker must select the answer that indicates the incorrect information.",Not Available,No,No,Knowledge & Skills
Ruby (New),https://www.shl.com/products/product-catalog/view/ruby-new,"Multi-choice test that measures the knowledge of Ruby strings, collection classes, regular expressions, methods, object oriented programming, exception handling, database connectivity, threads, scripting, network programming and web applications.",Not Available,No,No,Knowledge & Skills
Ruby on Rails (New),https://www.shl.com/products/product-catalog/view/ruby-on-rails-new,"Multi-choice test that measures the knowledge of Ruby Programming, Rails installation, Rails MVC and Rails programming model.",Not Available,No,No,Knowledge & Skills
Manufac. & Indust. - Safety & Dependability 8.0,https://www.shl.com/products/product-catalog/view/safety-and-dependability-focus-8-0,"The Manufacturing & Industrial Safety & Dependability Focus 8.0 Job-Focused Assessment measures the behaviors that underlie safe performance in a work setting. This solution assesses foundational behaviors including behaving safely in the workplace; complying with rules and regulations; applying domain-related expertise; and attending to multiple tasks. Potential job titles that use this solution include: Machine and Equipment Operators, Laborers/Warehouse Workers, Assemblers & Fitters, Maintenance/Repair Workers, Dispatchers, Surveillance, Quality Assurance Workers, Material Handlers, and Truck/Ship Loaders",Not Available,No,No,Personality & Behavior
Sales & Service Phone Simulation,https://www.shl.com/products/product-catalog/view/sales-and-service-phone-simulation,"As part of Contact Center Simulations, the Sales & Service Phone Simulation is designed for contact center roles that involve sales or sales-related behaviors such as recommending products or services and retaining customers. Sample tasks for these jobs include: interacting with customers on the phone to sell a product/service; adding new or upgraded products or services; extending promotional or retention offers; responding appropriately to customer objections; navigating to information menus to assist the customer and process information; and typing information quickly and accurately. Potential job titles that use this simulation include: telesales representative, outbound sales representative, telemarketer, and contact center representative.",Not Available,No,No,Simulations | Personality & Behavior
Sales & Service Phone Solution,https://www.shl.com/products/product-catalog/view/sales-and-service-phone-solution,"As part of Contact Center Simulations, the Sales & Service Phone Solution includes a contact center simulation and three behavioral tests designed to measure a wide range of skills, competencies, and behavioral tendencies relevant for contact center jobs. This solution is designed for contact center roles that involve sales or sales-related behaviors such as recommending products or services and retaining customers. Sample tasks for these jobs include: interact with customers on the phone to sell a product/service; add new or upgraded products or services; extend promotional or retention offers; respond appropriately to customer objections; navigate to information menus to assist the customer and process information; and type information quickly and accurately. Potential job titles that use this simulation are: Telesales Representative, Telemarketer, and Contact Center Representative. The behavioral tests in this solution are intended to measure the candidate’s sales focus, learning potential, and the tendency to meet goals and work hard, even when faced with obstacles. Collectively, the assessments in this solution measure a wide range of important skills, abilities, and behaviors for entry-level contact center roles involving sales or sales and service.",Not Available,No,No,Personality & Behavior | Simulations
Sales Director Solution,https://www.shl.com/products/product-catalog/view/sales-director-solution,"The Sales Director solution is for mid- to senior-level sales management positions that oversee the sales function across multiple offices or geographic territories. Sample tasks for these jobs include, but are not limited to: directing a group of sales supervisors or sales managers, having profit and loss responsibility for a district or region, and aligning work with overall company goals. Potential job titles that use this solution are: Regional Sales Director, District Sales Manager, and Sales Director. Multiple configurations of this solution are available.",Not Available,No,No,Ability & Aptitude | Personality & Behavior
Sales Engineer Solution,https://www.shl.com/products/product-catalog/view/sales-engineer-solution,"The Sales Engineer solution is designed for use with professional level telecommunications engineers with distinct sales responsibilities. The solution is focused on positions that involve the design of telecommunications networks for specific customer applications, and places an emphasis on reasoning ability and sales ability. Sample tasks may include: designing network solutions to meet customer needs, communicating technical information to all levels of clients participating in the sales process, assisting or owning the sales process, and ensuring proper implementation of contracted equipment and services. Potential job titles that use this solution are: Sales Engineer, Senior Technical Consultant, and Technical Sales Lead. There are multiple configurations of this solution available.",Not Available,No,No,Ability & Aptitude | Personality & Behavior | Knowledge & Skills | Simulations
Sales Interview Guide,https://www.shl.com/products/product-catalog/view/sales-interview-guide,"The SHL Sales Model is mapped to the SHL Universal Competency Model (UCF). The Sales Model Interview guide was developed to enable you to use the Sales Report more effectively, by helping you prepare and execute you interviews more effectively.",Not Available,No,No,Personality & Behavior
Sales Manager Solution,https://www.shl.com/products/product-catalog/view/sales-manager-solution,"The Sales Manager solution is an assessment used for applying to entry to mid-level sales leadership positions that generally manage employees and have a significant portion of their job performance based on sales. Sample tasks for these jobs include, but are not limited to: planning and preparing sales plans, promoting products to customers, training subordinates, building ongoing customer relationships, and making day-to-day decisions with minimal guidance from others. Potential job titles that use this solution are: Sales Manager and Manager of Direct Sales.",Not Available,No,No,Ability & Aptitude | Personality & Behavior
Sales Professional 7.0 Solution,https://www.shl.com/products/product-catalog/view/sales-professional-7-0-solution,"Our Sales Professional 7.0 solution is designed for entry to mid-level sales positions in which employees proactively sell products to customers, develop relationships with repeat customers, and have their pay and/or performance heavily based on sales revenue. Sample tasks for these jobs include, but are not limited to: promoting products to customers, persuading customers to buy products, and building ongoing customer relationships.
Report Language Availability: English (USA).",Not Available,No,No,Competencies | Personality & Behavior
Sales Professional 7.1 (Americas),https://www.shl.com/products/product-catalog/view/sales-professional-7-1-%28americas%29,"Our Sales Professional 7.1 solution is designed for entry to mid-level sales positions in which employees proactively sell products to customers, develop relationships with repeat customers, and have their pay and/or performance heavily based on sales revenue. Sample tasks for these jobs include, but are not limited to: promoting products to customers, persuading customers to buy products, and building ongoing customer relationships.",Not Available,No,No,Personality & Behavior | Competencies
Sales Professional Solution,https://www.shl.com/products/product-catalog/view/sales-professional-solution,"The Sales Professional solution is for entry to mid-level sales positions in which employees proactively sell products to customers, develop relationships with repeat customers, and have their pay and/or performance heavily based on sales revenue. Sample tasks for these jobs include, but are not limited to: promoting products to customers, persuading customers to buy products, and building ongoing customer relationships. Potential job titles that use this solution are: Sales Consultant, Sales Representative, and Account Representative. Multiple configurations of this solution are available.",Not Available,No,No,Ability & Aptitude | Personality & Behavior
Sales Profiler Cards,https://www.shl.com/products/product-catalog/view/sales-profiler-cards,"The SHL Sales Model is mapped to the SHL Universal Competency Model (UCF). The Sales Model Profiler cards have been developed to enable you to use the Sales Report more effectively, by helping you to understand which competencies and motivators described in the report are most important to a specific sales role.",Not Available,No,No,Personality & Behavior
Sales Representative Solution,https://www.shl.com/products/product-catalog/view/sales-representative-solution,"The Sales Representative solution is for entry-level sales positions in which employees proactively sell products to customers and have their pay and/or performance based on sales revenue. Sample tasks for these jobs include, but are not limited to: promoting products to customers, persuading customers to buy products, and completing a transaction with a customer. Potential job titles that use this solution are: Sales Representative, Sales Associate, and Sales Clerk. Multiple configurations of this solution are available.",Not Available,No,No,Ability & Aptitude | Personality & Behavior
Sales Supervisor Solution,https://www.shl.com/products/product-catalog/view/sales-supervisor-solution,"The Sales Supervisor solution is an assessment used for job candidates applying to entry-level sales leadership positions that generally supervise employees and have a significant portion of their job performance based on sales. Sample tasks for these jobs include, but are not limited to: planning and preparing work schedules, promoting products to customers; training subordinates; building ongoing customer relationships; and making day-to-day decisions with minimal guidance from others. Potential job titles that use this solution are: Assistant Sales Manager and Sales Supervisor. Multiple configurations of this solution are available.",Not Available,No,No,Ability & Aptitude | Personality & Behavior
Sales Support Specialist Solution,https://www.shl.com/products/product-catalog/view/sales-support-specialist-solution,"The Sales Support Specialist solution is for entry to mid-level sales support positions in which employees work primarily under the guidance of an account manager or operations manager in support of client accounts. Sample tasks for these jobs include, but are not limited to: implementing customer orders, assisting with and coordinating activities, and utilizing processes to meet customer requirements. Potential job titles that use this solution are: Implementation Specialist, Project Assistant, and Sales Support Assistant. Multiple configurations of this solution are available.",Not Available,No,No,Ability & Aptitude | Personality & Behavior
Sales Transformation Report 2.0 - Sales Manager,https://www.shl.com/products/product-catalog/view/sales-transformation-report-2-0-sales-manager,"This report combines insights from the OPQ and a Sales Management questionnaire. It provides an accurate and objective measure of a sales manager’s capability to lead a sales team undergoing a sales transformation process. Insights included in this report include an overall job-fit score, and individual scores and score narratives for the behaviours included in SHL’s Sales Transformation behavioural model.",Not Available,No,No,Personality & Behavior
Sales Transformation 1.0 - Individual Contributor,https://www.shl.com/products/product-catalog/view/sales-transformation-report-individual-contributor,This report draws insights from the OPQ. It provides an accurate and objective measure of a salesperson’s ability to sell well in a digital first environment. Insights included in this report include individual scores and score narratives for the behaviours included in SHL’s Sales Transformation behavioural model.,Not Available,No,No,Personality & Behavior
Sales Transformation Report 1.0 - Sales Manager,https://www.shl.com/products/product-catalog/view/sales-transformation-report-sales-manager,"This report combines insights from the OPQ and a Sales Management questionnaire. It provides an accurate and objective measure of a sales manager’s capability to lead a sales team undergoing a sales transformation process. Insights included in this report include an overall job-fit score, and individual scores and score narratives for the behaviours included in SHL’s Sales Transformation behavioural model.",Not Available,No,No,Personality & Behavior
Salesforce Development (New),https://www.shl.com/products/product-catalog/view/salesforce-development-new,"Multi-choice test that measures the knowledge of Salesforce platform, design and data models, business logic, data management and analytics.",Not Available,No,No,Knowledge & Skills
Sales Transformation 2.0 - Individual Contributor,https://www.shl.com/products/product-catalog/view/salestransformationreport2-0-individualcontributor,This report draws insights from the OPQ. It provides an accurate and objective measure of a salesperson’s ability to sell well in a digital first environment. Insights included in this report include individual scores and score narratives for the behaviours included in SHL’s Sales Transformation behavioural model.,Not Available,No,No,Personality & Behavior
SAP ABAP (Advanced Level) (New),https://www.shl.com/products/product-catalog/view/sap-abap-advanced-level-new,"Multi-choice test that measures the knowledge of SAP ABAP dictionary, dialog programming, reports, enhancements, workflows, optimizations and advanced ABAP concepts like Netweaver applications and Adobe forms.",Not Available,No,No,Knowledge & Skills
SAP ABAP (Intermediate Level) (New),https://www.shl.com/products/product-catalog/view/sap-abap-intermediate-level-new,"Multi-choice test that measures the knowledge of SAP ABAP dictionary, elements, operations, architecture, ABAP data types, ABAP reporting, batch data communication, dialog programming, EDI, ALE, IDOC interface, BADI, BAPI and function module.",Not Available,No,No,Knowledge & Skills
SAP Basis (New),https://www.shl.com/products/product-catalog/view/sap-basis-new,"Multi-choice test that measures the knowledge of SAP architecture, database administration, background processing, user administration, client administration, system administration, monitoring and transport management.",Not Available,No,No,Knowledge & Skills
SAP Business Objects WebI (New),https://www.shl.com/products/product-catalog/view/sap-business-objects-webi-new,"Multi-choice test that measures the knowledge of SAP interactive analysis, reporting, formatting and scheduling documents.",Not Available,No,No,Knowledge & Skills
SAP BW (Business Warehouse) (New),https://www.shl.com/products/product-catalog/view/sap-bw-business-warehouse-new,"Multi-choice test that measures the knowledge of SAP architecture, meta data, data modelling, extraction, loading, scheduling, data reporting, performance tuning and SAP BW/BI integration.",Not Available,No,No,Knowledge & Skills
SAP HCM (Human Capital Management) (New),https://www.shl.com/products/product-catalog/view/sap-hcm-human-capital-management-new,"Multi-choice test that measures the knowledge of SAP HR/ HCM structure, personnel administration, SAP HCM tasks, SAP HCM SuccessFactors solutions.",Not Available,No,No,Knowledge & Skills
SAP Hybris (New),https://www.shl.com/products/product-catalog/view/sap-hybris-new,"Multi-choice test that measures the knowledge of Hybris extensions, its architecture, configuration, data modelling and management, service layer programming, cockpit framework and workflows.",Not Available,No,No,Knowledge & Skills
SAP Materials Management (New),https://www.shl.com/products/product-catalog/view/sap-materials-management-new,"Multi-choice test that measures the knowledge of SAP materials management, organization units integration, purchasing, pricing, release procedure, contracts, inventory management, invoice verification, split valuation, account determination and integration of materials management with other modules.",Not Available,No,No,Knowledge & Skills
SAP SD (Sales and Distribution) (New),https://www.shl.com/products/product-catalog/view/sap-sd-sales-and-distribution-new,"Multi-choice test that measures the knowledge of ERP basics, SAP architecture, sales, distribution, master data, documents, basic functions in S&D, billing process, order and delivery processing.",Not Available,No,No,Knowledge & Skills
Search Engine Optimization (New),https://www.shl.com/products/product-catalog/view/search-engine-optimization-new,"Multi-choice test that measures the knowledge on the concepts of need of SEO, SEO planning, SEO strategies, SEO software, tools and exchanging links.",Not Available,No,No,Knowledge & Skills
Selenium (New),https://www.shl.com/products/product-catalog/view/selenium-new,"Multi-choice test that measures the knowledge of Selenium IDE, Selenium RC, Selenium grid, web driver, test design considerations, user extensions, frameworks and object repository.",Not Available,No,No,Knowledge & Skills
Senior Insurance Agent Solution,https://www.shl.com/products/product-catalog/view/senior-insurance-agent-solution,"The Senior Insurance Agent solution is for senior-level professional positions in the insurance industry that sell a portfolio of insurance products, including property, casualty, automotive, health, and life. Sample tasks for this position include, but are not limited to: calling on policyholders to deliver and explain policies or suggest additions or changes; calculating premiums; customizing insurance programs to suit individual customers; ensuring policy requirements are fulfilled; and conferring with clients to obtain and provide information when claims are made on a policy. Potential job titles that use this solution are: Insurance Senior Sales Professional, Senior Producer, Insurance Sales Agent, and Insurance Agent. Multiple configurations of this solution are available.",Not Available,No,No,Ability & Aptitude | Personality & Behavior
Senior Sales Professional Solution,https://www.shl.com/products/product-catalog/view/senior-sales-professional-solution,"The Senior Sales Professional solution is for high-level sales positions in which employees proactively sell products to customers, develop relationships with new or existing customers, and have their pay and/or performance heavily based on sales revenue. Sample tasks for these jobs include, but are not limited to: promoting products to customers, consulting with and persuading customers to buy products, and building ongoing customer relationships. Potential job titles that use this solution are: Senior Sales Representative, Business Development Manager, and Senior Sales Consultant. Multiple configurations of this solution are available.",Not Available,No,No,Ability & Aptitude | Personality & Behavior
Server Solution,https://www.shl.com/products/product-catalog/view/server-solution,"The Server solution is designed for entry-level positions in the hospitality industry. Sample tasks include greeting customers, taking customer food and drink orders and delivering food items to guests. The solution is focused on work ethic, customer focus and sales. Potential job titles that use this solution are: Server and Waiter/Waitress. Multiple configurations of this solution are available.",Not Available,No,No,Personality & Behavior | Ability & Aptitude
Service Associate Solution,https://www.shl.com/products/product-catalog/view/service-associate-solution,"The Service Associate is designed for entry-level positions that are primarily task focused but may include a customer service component. The solution covers a wide variety of support positions in the hospitality industry and sample tasks may include: cleaning hotel rooms, serving food at buffet lines, parking cars, and/or delivering food to hotel rooms. Potential job titles that use this solution are: Housekeeper, Buffet Server, Room Service Attendant, and Valet. Multiple configurations of this solution are available.",Not Available,No,No,Ability & Aptitude | Personality & Behavior
Service Supervisor Solution,https://www.shl.com/products/product-catalog/view/service-supervisor-solution,"The Service Supervisor solution is designed for entry-level leadership positions in the hospitality industry that oversee hourly and salaried employees in customer facing positions (e.g. Front Desk Associate, Concierge, Guest Service Associate). Individuals in these roles perform many of hte duties of the employees they supervise. Sample tasks may include: assisting challenging guests, coaching employees on their customer service skills, taking corrective action when an employee is performing poorly, and monitoring employees to assess the satisfactory completion of tasks. Potential job titles that use this solution are: Front Desk Manager, Guest Services Supervisor, and Front Desk Supervisor. Multiple configurations of this solution are available.",Not Available,No,No,Ability & Aptitude | Personality & Behavior
Shell Scripting (New),https://www.shl.com/products/product-catalog/view/shell-scripting-new,"Multi-choice test that measures the knowledge of Shell scripting to perform operations such as file manipulation, program execution and printing text.",Not Available,No,No,Knowledge & Skills
SHL Verify Interactive – Deductive Reasoning,https://www.shl.com/products/product-catalog/view/shl-verify-interactive-deductive-reasoning,"Chinese Traditional, Romanian, Turkish, Polish, Greek, Latin American Spanish, Portuguese (Brazil), Japanese, Hungarian, Czech, French (Canada), Slovak, Serbian, English International, English (USA), German, Italian, Indonesian, Korean, Russian, Arabic, Danish, Finnish, Norwegian, Swedish, Estonian, Latvian, Lithuanian, French, Dutch, Chinese Simplified, Spanish, Portuguese,",Not Available,No,No,Ability & Aptitude | Simulations
SHL Verify Interactive G+,https://www.shl.com/products/product-catalog/view/shl-verify-interactive-g,"SHL Verify Interactive G+ (SVIG+) is a test of general cognitive ability that also generates accurate assessments of three specific abilities: Deductive Reasoning, Inductive Reasoning, and Numerical Reasoning. The candidate will see questions measuring all three abilities. Candidates will receive a score on each of the specific abilities as well as a general ability score. This test is appropriate for all job levels, however it is most relevant for positions that require cognitive ability across a range of specific skills. Completion time is 36 minutes for the test itself, plus 10 minutes for instructions and practice.",36 minutes,No,No,Ability & Aptitude
SHL Verify Interactive - Inductive Reasoning,https://www.shl.com/products/product-catalog/view/shl-verify-interactive-inductive-reasoning,"Korean, Japanese, Thai, Portuguese (Brazil), Portuguese, Chinese Traditional, Indonesian, Russian, Romanian, Polish, Greek, Latin American Spanish, English International, Arabic, Hungarian, Czech, French (Canada), Slovak, Serbian, Turkish, Spanish, Danish, Estonian, Finnish, Latvian, Lithuanian, Norwegian, Swedish, French, German, Italian, Dutch, Chinese Simplified, English (USA),",Not Available,No,No,Ability & Aptitude | Simulations
SHL Verify Interactive Numerical Calculation,https://www.shl.com/products/product-catalog/view/shl-verify-interactive-numerical-calculation,"The Verify Interactive Numerical Calculation test measures a candidate’s ability to work with numbers and use appropriate mathematics in different situations. The Numerical Ability test requires candidates to understand order of operations, perform numerical calculations, and identify errors in calculations. The Numerical Calculation test, though it is adaptive, is ideal for entry-level jobs that require completing simple numerical calculations quickly and accurately.",Not Available,No,No,Ability & Aptitude
