name,url,description,duration,remote_support,adaptive_support,test_type
360 Digital Report,https://www.shl.com/products/product-catalog/view/360-digital-report,"Introducing the new 360 Digital Report from SHL! Our latest offering revolutionizes the reporting experience for our 360 products, catering to the modern user's needs for enhanced usability and actionable insights. With a sleek, interactive interface, this report provides a exploration of feedback data, focusing on user development and comprehensive evaluation. Users can now enjoy a visually engaging experience, with the capability to download the report in PDF format for offline access. Upgrade your reporting experience today with SHL's innovative 360 Digital Report!",Not Available,No,No,Development & 360
360° Multi-Rater Feedback System (MFS),https://www.shl.com/products/product-catalog/view/360-multi-rater-feedback-system-mfs,"SHL 360, or the Multi-Rater Feedback System (‘MFS’), provides a holistic 360-degree view of an employee by gathering feedback from the employee’s manager, peers, direct reports, and/or other raters. By offering a wide range of perspectives, 360 feedback gives employees a more thorough understanding of not only their strengths, weaknesses, and development opportunities, but also their impact on others. 360-degree multi-rater assessments are based on SHL’s Universal Competency Framework (“UCF”), using our proven library of research-driven competencies to provide opportunities for managers, peers, and direct reports to supply useful developmental feedback that they may not otherwise share. SHL can also offer support and training throughout the entire process, from defining objectives through interpreting and delivering the feedback. 360 feedback serves all levels and industries and is a positive and powerful addition to your performance management system.",Not Available,No,No,Development & 360 | Personality & Behavior
Account Manager Solution,https://www.shl.com/products/product-catalog/view/account-manager-solution,"The Account Manager solution is an assessment used for job candidates applying to mid-level leadership positions that tend to manage the day-to-day operations and activities of client accounts. Sample tasks for these jobs include, but are not limited to: communicating with clients about project status, developing and maintaining project plans, coordinating internally with appropriate project personnel, and ensuring client expectations are being met. Potential job titles that use this solution are: Account Executive, Account Manager, and Senior Account Manager. There are multiple configurations of this solution available.",Not Available,No,No,Competencies | Personality & Behavior | Ability & Aptitude
Accounts Payable (New),https://www.shl.com/products/product-catalog/view/accounts-payable-new,"Multiple-choice test that measures the knowledge of processing payables and vendor invoices, and the posting of journal entries.",Not Available,No,No,Knowledge & Skills
Accounts Payable Simulation (New),https://www.shl.com/products/product-catalog/view/accounts-payable-simulation-new,Simulated data entry test that measures the ability to process payables and vendor invoices.,Not Available,No,No,Simulations
Accounts Receivable (New),https://www.shl.com/products/product-catalog/view/accounts-receivable-new,Multiple-choice test that measures the knowledge of processing receivables and invoices.,Not Available,No,No,Knowledge & Skills
Accounts Receivable Simulation (New),https://www.shl.com/products/product-catalog/view/accounts-receivable-simulation-new,Simulated data entry test that measures the ability to process receivables and invoices.,Not Available,No,No,Simulations
Administrative Professional - Short Form,https://www.shl.com/products/product-catalog/view/administrative-professional-short-form,"The Administrative Professional solution is for entry to mid-level positions that involve routine clerical and administrative functions in addition to office management functions and customer service. Sample tasks for this job include, but are not limited to: arranging conference calls; drafting correspondence; scheduling meetings; greeting visitors; coordinating office activities. Potential job titles that use this solution are: Administrative Assistant, Secretary, Office Manager, Administrative Aide, and Administrative Associate.",Not Available,No,No,Ability & Aptitude | Knowledge & Skills | Personality & Behavior
ADO.NET (New),https://www.shl.com/products/product-catalog/view/ado-net-new,"Multi-choice test that measures the knowledge on the concepts of ADO.NET architecture, components and data provider objects.",Not Available,No,No,Knowledge & Skills
Adobe Experience Manager (New),https://www.shl.com/products/product-catalog/view/adobe-experience-manager-new,"Multi-choice test that measures the knowledge of AEM components, templates, workflows, AEM collections, OSGi services and troubleshooting of AEM projects.",Not Available,No,No,Knowledge & Skills
Adobe Photoshop CC,https://www.shl.com/products/product-catalog/view/adobe-photoshop-cc,"The Adobe Photoshop CC test measures knowledge of Adobe Photoshop CC. Designed for experienced users, this test covers the following topics: 3D, Color, File Management, Interface, Layers, Painting and Drawing, Retouch and Enhancements, Selection, Text, and Web.",Not Available,No,No,Knowledge & Skills
Aeronautical Engineering (New),https://www.shl.com/products/product-catalog/view/aeronautical-engineering-new,"Multi-choice test that measures the knowledge of flight mechanics, space dynamics, aerodynamics, structures and propulsion.",Not Available,No,No,Knowledge & Skills
Aerospace Engineering (New),https://www.shl.com/products/product-catalog/view/aerospace-engineering-new,"Multi-choice test that measures the conceptual knowledge of aerodynamics, aircraft systems and instrumentation, flight dynamics, space dynamics and avionics.",Not Available,No,No,Knowledge & Skills
Agency Manager Solution,https://www.shl.com/products/product-catalog/view/agency-manager-solution,"The Agency Manager solution is for mid-level sales management positions that include front line management and sales responsibilities. Sample tasks for this job include, but are not limited to: directing and coordinating financial activities of workers in a branch, office, or department of an establishment, such as branch bank, brokerage firm, risk and insurance department, or credit department. Potential job titles that use this solution are: Agency Manager, Brokerage Manager. Multiple configurations of this solution are available.",Not Available,No,No,Ability & Aptitude | Personality & Behavior | Simulations
Agile Software Development,https://www.shl.com/products/product-catalog/view/agile-software-development,"Multi-choice test that measures the knowledge of agile methodology, scrum, feature driven software development, incremental and iterative development and processes involved in agile software development.",7 minutes,No,No,Knowledge & Skills
Agile Testing (New),https://www.shl.com/products/product-catalog/view/agile-testing-new,"Multi-choice test that measures the knowledge of tools, techniques and processes involved in the Agile testing methodology.",Not Available,No,No,Knowledge & Skills
AI Skills,https://www.shl.com/products/product-catalog/view/ai-skills,The AI Skills assessment measures the skills that help candidates successfully leverage AI in their work.,Not Available,No,No,Personality & Behavior
Amazon Web Services (AWS) Development (New),https://www.shl.com/products/product-catalog/view/amazon-web-services-aws-development-new,"Multi-choice test that measures the knowledge of AWS delivery process, monitoring, metrics, logging, security, validation and scalability.",Not Available,No,No,Knowledge & Skills
Android Development (New),https://www.shl.com/products/product-catalog/view/android-development-new,"Multi-choice test that measures the knowledge of UI components for an Android device, services and alerts, animation and media apps, application components, security and testing.",Not Available,No,No,Knowledge & Skills
Angular 6 (New),https://www.shl.com/products/product-catalog/view/angular-6-new,"Multi-choice test that measures the knowledge of the basic components and modules of Angular 6 and concepts like data binding, dependency injection, CRUD with HTTP, typescript, routing and navigation.",Not Available,No,No,Knowledge & Skills
AngularJS (New),https://www.shl.com/products/product-catalog/view/angularjs-new,"Multi-choice test that measures the knowledge of AngularJS architecture, forms, directives, filters, controllers, routing and testing.",Not Available,No,No,Knowledge & Skills
Apache Hadoop Extensions (New),https://www.shl.com/products/product-catalog/view/apache-hadoop-extensions-new,"Multi-choice test that measures the conceptual knowledge of Pig, Hive and HBase.",Not Available,No,No,Knowledge & Skills
Apache Hadoop (New),https://www.shl.com/products/product-catalog/view/apache-hadoop-new,"Multi-choice test that measures the knowledge of basic concepts of Hadoop, commands, HDFS and MapReduce.",Not Available,No,No,Knowledge & Skills
Apache HBase (New),https://www.shl.com/products/product-catalog/view/apache-hbase-new,"Multi-choice test that measures the knowledge of HBase concepts such as CAP theorem, ACID properties, HBase client API, MapReduce integration, configuration and administration.",Not Available,No,No,Knowledge & Skills
Apache Hive (New),https://www.shl.com/products/product-catalog/view/apache-hive-new,"Multi-choice test that measures the knowledge of Hive architecture, datatypes, built-in functions, configurations, partitioning, bucketing and commands of Hive query language.",Not Available,No,No,Knowledge & Skills
Apache Kafka (New),https://www.shl.com/products/product-catalog/view/apache-kafka-new,"Multi-choice test that measures the knowledge of Apache Kafka architecture, components, clusters, performance tuning and advanced operations.",Not Available,No,No,Knowledge & Skills
Apache Pig (New),https://www.shl.com/products/product-catalog/view/apache-pig-new,"Multi-choice test that measures the knowledge of Pig architecture, built-in operators, built-in functions and commands in PigLatin.",Not Available,No,No,Knowledge & Skills
Apache Spark (New),https://www.shl.com/products/product-catalog/view/apache-spark-new,"Multi-choice test that measures the knowledge of Apache Spark principles, RDD operations - actions and transformations, lineage graphs and lazy evaluation.",Not Available,No,No,Knowledge & Skills
Apprentice 8.0 Job Focused Assessment,https://www.shl.com/products/product-catalog/view/apprentice-8-0-job-focused-assessment,"The Apprentice 8.0 Job-Focused Assessment is a short, targeted, globally applicable assessment. This assessment is designed for entry-level positions appropriate for countries and industries that use an apprenticeship model. It is intended to be used multi-nationally for organizations whose business spans across regions.",Not Available,No,No,Personality & Behavior
Apprentice + 8.0 Job Focused Assessment,https://www.shl.com/products/product-catalog/view/apprentice-8-0-job-focused-assessment-4261,"The Apprentice + 8.0 Job-Focused Assessment is a short, targeted, globally applicable assessment which includes a short cognitive ability measure. This assessment is designed for entry-level positions appropriate for countries and industries that use an apprenticeship model. It is intended to be used multi-nationally for organisations whose business spans across regions.",Not Available,No,No,Personality & Behavior
ASP.NET 4.5,https://www.shl.com/products/product-catalog/view/asp-net-4-5,"The ASP.NET 4.5 test measures knowledge of programming in the ASP.NET environment. Designed for experienced developers, but an average performer in this role should pass this test. This test includes the following topics: .NET Framework, Client-Side Programming, Data Access, Enhanced Runtime Features, Portals, Services and Mobile, Security, Troubleshooting and Optimization, Web Applications, and Web Forms.",Not Available,No,No,Knowledge & Skills
ASP .NET with C# (New),https://www.shl.com/products/product-catalog/view/asp-net-with-c-new,"Multi-choice test that measures the knowledge of .NET framework and controls, C# fundamentals, OOPs concepts and advanced topics such as data access components, state management and security services.",Not Available,No,No,Knowledge & Skills
Assessment and Development Center Exercises,https://www.shl.com/products/product-catalog/view/assessment-and-development-center-exercises,"SHL offers a comprehensive range of Assessment and Development Centre exercise in digital format, for remote assessment through our Virtual Assessment and Development Centre platform.
We offer a wide range of exercise types including group exercise, role plays, analysis presentations and written exercises.
Exercises are available across a wide range of job levels and industry contexts.
Contact SHL to find out more.",Not Available,No,No,Assessment Exercises
Automata Data Science (New),https://www.shl.com/products/product-catalog/view/automata-data-science-new,A simulated test that measures the ability to analyze and modify data using machine learning algorithms to obtain desirable results.,Not Available,No,No,Simulations
Automata Data Science Pro (New),https://www.shl.com/products/product-catalog/view/automata-data-science-pro-new,A simulated test that measures the ability to analyze and modify data using machine learning algorithms to obtain desirable results.,Not Available,No,No,Simulations
Automata - Fix (New),https://www.shl.com/products/product-catalog/view/automata-fix-new,"A simulated compiler integrated test to measure debugging skills in C, C++ and Java. The test checks the ability to fix logical or syntactical errors and to reuse an existing code.

Your use of this assessment product may be subject to New York City Law 144 (Regulation of the Use of Automated Employment Decision Tools) (dated July 5, 2023). Compliance with Law 144 is your responsibility. Read more on https://www.shl.com/legal/shl-us-regulatory-compliance/",Not Available,No,No,Simulations
Automata Front End,https://www.shl.com/products/product-catalog/view/automata-front-end,"Simulation based test that measures the front-end development capabilities using HTML, CSS, and JavaScript. The candidate is provided with 3 different sections to code in HTML, CSS and JavaScript respectively and a separate output section to view the output. This simulation is then manually scored.",30 minutes,No,No,Simulations
Automata (New),https://www.shl.com/products/product-catalog/view/automata-new,"An AI-powered coding simulation assessment that evaluates candidate’s programming ability. Offers a familiar IDE environment available in over 40 different programming languages and tests candidates using real-world coding problems.

Your use of this assessment product may be subject to New York City Law 144 (Regulation of the Use of Automated Employment Decision Tools) (dated July 5, 2023). Compliance with Law 144 is your responsibility. Read more on https://www.shl.com/legal/shl-us-regulatory-compliance/",Not Available,No,No,Simulations
Automata Pro (New),https://www.shl.com/products/product-catalog/view/automata-pro-new,"An AI-powered coding simulation assessment that evaluates candidate’s programming ability. Offers a familiar IDE environment available in over 40 different programming languages and tests candidates using real-world coding problems.

Your use of this assessment product may be subject to New York City Law 144 (Regulation of the Use of Automated Employment Decision Tools) (dated July 5, 2023). Compliance with Law 144 is your responsibility. Read more on https://www.shl.com/legal/shl-us-regulatory-compliance/",Not Available,No,No,Simulations
Automata Selenium,https://www.shl.com/products/product-catalog/view/automata-selenium,A coding simulation assessment that evaluates the ability to conduct tasks related to automation testing using Selenium scripts.,Not Available,No,No,Simulations
Automata - SQL (New),https://www.shl.com/products/product-catalog/view/automata-sql-new,"A simulated query writing test that measures the ability to write SQL queries to perform DDL, DML and DCL tasks.",Not Available,No,No,Simulations
Automation Anywhere RPA Development (New),https://www.shl.com/products/product-catalog/view/automation-anywhere-rpa-development-new,"Multi-choice test that measures the knowledge of Automation Anywhere dash board and task editor, control room, key commands, bots and Automation Anywhere client.",Not Available,No,No,Knowledge & Skills
Automotive Engineering (New),https://www.shl.com/products/product-catalog/view/automotive-engineering-new,"Multi-choice test that measures the knowledge of auto engine classification, engine fuel system, auto-vehicle technology, maintenance, inspection and troubleshooting.",Not Available,No,No,Knowledge & Skills
Bank Administrative Assistant - Short Form,https://www.shl.com/products/product-catalog/view/bank-administrative-assistant-short-form,"The Administrative Assistant solution is for entry-level clerical positions that interact with external or internal customers. Sample tasks for these jobs include, but are not limited to: answering telephones, managing files and records, sorting mail, greeting customers, and collaborating with co-workers on projects. Potential job titles that use this solution are: Receptionist and Administrative Assistant. There are multiple configurations of this solution available.",Not Available,No,No,Ability & Aptitude | Personality & Behavior | Knowledge & Skills
Bank Collections Agent - Short Form,https://www.shl.com/products/product-catalog/view/bank-collections-agent-short-form,"This solution is for entry-level collections positions in an inbound or outbound call center environment in a financial setting. Candidates answer multiple choice questions to measure achievement orientation, dependability, collector numerical skills, revenue recovery, customer focus, and persistence and planfulness. There are multiple configurations and versions of this solution available.",Not Available,No,No,Ability & Aptitude | Personality & Behavior
Bank Operations Supervisor - Short Form,https://www.shl.com/products/product-catalog/view/bank-operations-supervisor-short-form,"The Bank Operations Supervisor solution is for job candidates applying to entry-level leadership positions who tend to supervise hourly employees. Sample tasks for these jobs include, but are not limited to: planning and preparing work schedules, assigning employees to specific duties; coaching employees on attendance, conduct, schedule adherence, and work tasks, developing employees' skills ; training subordinates; prioritizing multiple tasks and priorities; and making day-to-day decisions with minimal guidance from others. Potential job titles that use this solution are: Team Leader, First Line Supervisor, Processing Supervisor, Call Center Supervisor, and Customer Service Supervisor. There are multiple configurations and versions of this solution available.",Not Available,No,No,Ability & Aptitude | Personality & Behavior | Simulations
Basic Biology (New),https://www.shl.com/products/product-catalog/view/basic-biology-new,Multi choice test that measures the candidate's basic understanding of Biology.,Not Available,No,No,Knowledge & Skills
Basic Computer Literacy (Windows 10) (New),https://www.shl.com/products/product-catalog/view/basic-computer-literacy-windows-10-new,"The Basic Computer Literacy (Windows 10) simulation measures knowledge of general computer terminology, processes, and applications and the ability to perform certain operations in a simulated environment resembling the actual application. This simulation consists of both multiple choice and simulation-based questions, and includes the following topics: Application Software, Computer Terms, Internet and Email, Managing Files, Operating System, and Parts of the Computer.",Not Available,No,No,Simulations | Knowledge & Skills
Basic Statistics (New),https://www.shl.com/products/product-catalog/view/basic-statistics-new,"Multi-choice test that measures the knowledge of statistical methods, exploratory analysis, basics of probability, standard distributions and statistical testing.",Not Available,No,No,Knowledge & Skills
Bilingual Spanish Reservation Agent Solution,https://www.shl.com/products/product-catalog/view/bilingual-spanish-reservation-agent-solution,"The Bilingual Reservation Agent solution is designed for customer centered entry-level positions within the hospitality industry. Sample tasks may include making, updating, or canceling hotel reservations made in English or Spanish; listening to customers speak Spanish and entering information into a computer in English; providing information on the hotel and the services offered. Potential job titles that use this solution are: Bilingual Reservation Agent, Customer Service Representative and Reservationist. Multiple configurations of this solution are available.",Not Available,No,No,Personality & Behavior | Simulations | Ability & Aptitude
Biochemistry (New),https://www.shl.com/products/product-catalog/view/biochemistry-new,"Multi-choice test that measures the knowledge of various bio-molecules like amino acids, proteins, enzymes, carbohydrates, vitamins and nucleic acids, and concepts of bioenergetics and metabolism.",Not Available,No,No,Knowledge & Skills
Biotech Lab Techniques (New),https://www.shl.com/products/product-catalog/view/biotech-lab-techniques-new,"Multi-choice test that measures the knowledge of biophysical techniques, bio-processing and separation techniques like chromatography and electrophoresis.",Not Available,No,No,Knowledge & Skills
BizTalk (New),https://www.shl.com/products/product-catalog/view/biztalk-new,"Multi-choice test that measures the knowledge of BizTalk architecture, pipelines, adapters, business process techniques and BizTalk administration.",Not Available,No,No,Knowledge & Skills
"Bookkeeping, Accounting, Auditing Clerk Short Form",https://www.shl.com/products/product-catalog/view/bookkeeping-accounting-auditing-clerk-short-form,"The Bookkeeping, Accounting, and Auditing Clerk solution is for entry-level positions that involve entering numerical data into computer systems and maintaining financial records. Sample tasks for this job include, but are not limited to: entering financial data into computers; checking financial records for accuracy; perform routine computations on financial data. Potential job titles that use this solution are: Accounting Clerk, Bookkeeper, Accounting Associate, Auditing Clerk and Accounts Receivable Clerk.",Not Available,No,No,Personality & Behavior | Simulations | Knowledge & Skills | Ability & Aptitude
Branch Manager - Short Form,https://www.shl.com/products/product-catalog/view/branch-manager-short-form,"This solution is for mid to upper-level financial institution managerial positions. Candidates answer a series of multiple choice questions to measure management potential, management judgment, leadership potential, team management, branch manager problem solving, business leadership, leadership motivation, interpersonal leadership, self leadership, and branch manager judgment. There are multiple configurations and versions of this solution available.",Not Available,No,No,Ability & Aptitude | Personality & Behavior
Business Communication (adaptive),https://www.shl.com/products/product-catalog/view/business-communication-adaptive,"This is an adaptive test that measures knowledge of communicating in the workplace. It measures the skills necessary to communicate effectively with coworkers at all levels and with external business contacts. Designed for the average business worker, this test includes the following topics: Electronic Communication, Employment Communication, Listening, Meetings, Nonverbal Communication, Verbal Communication, and Written Communication.",Not Available,No,No,Knowledge & Skills
Business Communications,https://www.shl.com/products/product-catalog/view/business-communications,"This test measures the candidate's knowledge of communicating in the workplace. It measures the skills necessary to communicate effectively with coworkers at all levels and with external business contacts. Designed for the average business worker, this test includes the following topics: Electronic Communication, Employment Communication, Listening, Meetings, Nonverbal Communication, Verbal Communication, and Written Communication. This version of the test is not adaptive.",Not Available,No,No,Knowledge & Skills
C Programming (New),https://www.shl.com/products/product-catalog/view/c-programming-new,"Multi-choice test that measures the knowledge of C programming basics, functions, arrays, composed data types, and advanced C concepts like SLF, file handling and dynamic memory.",Not Available,No,No,Knowledge & Skills
C# Programming (New),https://www.shl.com/products/product-catalog/view/c-programming-new-4039,"Multi-choice test that measures the knowledge of C# programming structure, functions, collections, enumeration, exception handling, OOPs constructs, inheritance, event handling and operator overloading.",Not Available,No,No,Knowledge & Skills
C++ Programming (New),https://www.shl.com/products/product-catalog/view/c-programming-new-4122,Multi-choice test that measures the knowledge of programming in the C++ language and the ability to use the C++ standard library to write code.,Not Available,No,No,Knowledge & Skills
